{"claim_id":"H6-T02-2/C002","frozen_role":"SUPPLIED_FACT","contract_id":"TARGET_FIDELITY","verdict":"SATISFIED","evaluation_provenance":[{"source_type":"TARGET","source_id":"T02"}],"unresolved_conditions":[],"rationale":"The target explicitly states that roughly one in twenty exports now takes more than an hour while median export time remains stable. The proposition faithfully preserves the approximate reported tail frequency without expanding its scope or certainty."}